{
  "identity": {
    "publisherKeyId": "ed25519:9f8e7d6c5b4a39281706f5e4d3c2b1a09f8e7d6c5b4a3928",
    "toolId": "com.example.hello-web"
  },
  "name": "Hello Web Tool",
  "summary": "免费示例 web 工具。",
  "license": "Apache-2.0",
  "channels": ["stable"],
  "latest": { "stable": "1.0.0" },
  "artifacts": [
    {
      "version": "1.0.0",
      "channel": "stable",
      "platform": "windows",
      "arch": "x86_64",
      "artifactSha256": "c0535e4be2b79ffd93291305436bf889314e4a3faec05ecffcbb7df31ad9e51a",
      "manifestDigest": "3a7bd3e2360a3d29eea436fcfb7e44c735d117c42d1c1835420b6b9942dd4f1b",
      "size": 12288,
      "permissions": [],
      "publishedAt": "2026-07-20T08:05:00Z",
      "withdrawn": false
    }
  ],
  "offer": {
    "accessMode": "free",
    "productId": null,
    "planIds": [],
    "purchaseUrl": null
  },
  "review": {
    "repositorySignatureVerified": true,
    "publisherSignatureVerified": true,
    "officialReviewPassed": false,
    "securityScanPassed": true,
    "sourceAvailable": true,
    "reproducibleBuildVerified": true
  },
  "isNativeWorker": false,
  "updatedAt": "2026-07-20T08:05:00Z"
}
